name;price;image_url;quantity;description;category;tax;power
name;price;image_url;quantity;description;category;tax;power
WHISKY CAOL ILA SIGNATORY VINTAGE 11YO (D.2010, B.2022) SHERRY CASK 0,7L 56,8%;819.00;https://alkoholeswiata24.pl/gfx/mini/1667397841.9209.jpg, https://alkoholeswiata24.pl/gfx/1667397841.9209.jpg;0;Whisky Caol Ila Signatory Vintage 11 YO (D.2010, B.2022) Sherry Cask 0,7l 56,8%;whisky wschodnie;1;Moc:56,8%
WHISKEY BOURBON ANGEL'S ENVY PORT WINE BARRELS FINISH 43,3% 0,7L;299.00;https://alkoholeswiata24.pl/gfx/mini/1692349793.1032.jpg, https://alkoholeswiata24.pl/gfx/1692349793.1032.jpg;4;"Whiskey Bourbon Angel's Envy Port Finish  to wysokiej jakości  produkowany w Louisville w stanie Kentucky i wprowadzony na rynek w 2011 roku. Do stworzenia burbonu przyczynił się mistrz destylacji Lincoln Henderson, który jest twórcą między innymi   czy   Nazwa ""Angel's Envy"" odnosi się do pozostałego destylatu po odparowaniu tak zwanego   (4-5% whiskey w USA).  Angel's Envy Port Finish bourbon po pierwszym dojrzewaniu przelewany jest do beczek po winie porto, gdzie spędza kolejne od 3 do 6 miesięcy. Zabutelkowana jest z mocą 43,3% ABV.  Bourbon Angel's Envy Port Finish - noty degustacyjne : Delikatne nuty wanilii, rodzynki, syrop klonowy, prażone orzechy. : Wanilia, słodkie dojrzałe owoce, syrop klonowy, pieczone tosty, gorzka czekolada.  : Długi i słodki, nuty winne, śliwki.";whisky zachodnie;1;Moc:43,3%
WHISKY KENSEI BLENDED 0,7L 40%  JAPONIA;204.91;https://alkoholeswiata24.pl/gfx/mini/1580481636.6571.jpg, https://alkoholeswiata24.pl/gfx/1580481636.6571.jpg;0;Japońska whisky cieszy się ogromną popularnością na całym świecie, znaną z wysokiej jakości i mistrzowskiego mieszania. Tworzenie whisky nie jest klasyfikowane jako produkcja w Japonii, ale raczej jako forma sztuki. Ceniony jest za delikatną harmonijną równowagę smaków i pożądany łagodny styl. Whisky Kensei zostały tak wykonane, że najlepiej spożywać je od razu. Wygląd:   złoty bursztyn Aromat:   delikatny kwiatowy aromat    Ciesz się smakami zimowych przypraw w połączeniu z karmelowymi i waniliowymi nutami. Długie owocowe zakończenie;whisky wschodnie;1;Moc:40%
WHISKEY BUSHMILLS 0,7L 40% IRLANDIA;81.00;https://alkoholeswiata24.pl/gfx/mini/1481207121.2716.jpg, https://alkoholeswiata24.pl/gfx/1481207121.2716.jpg;10;Jest kompozycją trzykrotnie destylowanej whiskey słodowej z delikatną whiskey zbożową. To whiskey o bogatym, pełnym charakteru smaku świeżych owoców i wanilii, z nutą przypraw w finiszu. Whiskey wchodzące w skład Bushmills Original dojrzewają w beczkach minimum 3 lata. Irlandzka whisky w dobrej cenie.;whisky zachodnie;1;Moc:40%
WHISKY ABERFELDY 12YO GOLD SINGLE MALT 40% 0,7L PUSZKA;213.90;https://alkoholeswiata24.pl/gfx/mini/1666691591.9346.jpg, https://alkoholeswiata24.pl/gfx/1666691591.9346.jpg;10;Whisky Aberfeldy 12 yo single malt Gold 0,7l puszka  w luksusowym złotym, metalowym pudełku prezentowym to nie tylko  , ale także dla nowicjuszy w piciu single malt i miłośnika słodkiej owocowej whisky.  w Szkocji, wytwarzana jest w destylarni Aberfeldy. Destylarnia została otwarta w 1898 roku przez synów Johna Dewar.  Gorzelnia była kilkakrotnie zamykana, ale od 1999 roku Aberfeldy produkuje whisky bez przerw. Aberfeldy 12 yo została stworzona między innymi po to, aby komponować z niej znaną whisky Dewar's. Whisky single malt Aberfeldy 12yo Gold powinna być degustowana samodzielnie, bez lodu bądź wody, aby móc pełniej cieszyć się jej smakiem i aromatem.  Whisky Aberfeldy 12yo Gold ma ciemny, złoty kolor. Aromat jest bardzo owocowy, wraz ze słodyczą miodu i nutami cytrusów. Smak jest pełen słodkich, soczystych owoców i delikatnej wanilii. Finisz długi, elegancki i dobrze zbalansowany, miękki i lekko owocowy. Szkocka whisky Aberfeldy 12yo Gold 0,7l  produkowana ze słodu uprawianego w Szkocji Midlands i wody z rzeki Tay, która płynie ścieżką rozpoczynającą się przy źródle Pitilie na kamieniu i piaskowcu, który staje się czystszy i bogatszy w minerały. Leżakowanie przez 12 lat w dębowych beczkach. Zabutelkowana z mocą 40% abv. Do whisky Aberfeldy została dołączona złota puszka prezentowa. Zamów online na oryginalny prezent dla konesera whisky.  Jak smakuje 12-letnia whisky Aberfeldy? : Słodki, akcenty miodu i ananasa. : Zrównoważony, słodki. Słodki syrop owocowy, miód, wanilia, krówki, suszone owoce. : Długi z delikatną nutą dymu.  Zaleca się otworzyć butelkę i odstawić na chwilę, aby whisky mogła pooddychać i uwolnić swój charakter. Doskonała propozycja na prezent na święta i nie tylko. Świetna dla zagorzałych koneserów mocnych trunków, jak i dla początkujących smakoszy.  Whisky   to obowiązkowa pozycja w twoim barku!;whisky zachodnie;1;Moc:40%
WHISKEY BUSHMILLS 21YO 0,7L 40%;739.00;https://alkoholeswiata24.pl/gfx/mini/1649421671.6043.jpg, https://alkoholeswiata24.pl/gfx/1649421671.6043.jpg;1;: Głęboki mahoń  Bogate nuty świeżego miodu i dojrzałych owoców łączą się z delikatnym aromatem orzechów laskowych i kakao .  Głęboki i bogaty. Gorzka czekolada i toffi z nutami wanilii, prażonych orzechów i dębu.  Długi, delikatny i harmonijny. Słodycz owoców połączona z tytoniem i nutą mięty.;whisky zachodnie;1;Moc:40%
WHISKY HATOZAKI BLENDED 0,7L 40% JAPONIA;168.01;https://alkoholeswiata24.pl/gfx/mini/1614979178.5072.jpg, https://alkoholeswiata24.pl/gfx/1614979178.5072.jpg;6;Mieszanka Hatozaki, mieszana whisky z destylarni Kaikyo, łączy w sobie zarówno whisky słodowe, jak i zbożowe, w tym whisky destylowaną w Japonii i importowane. Nazwa whisky pochodzi od najstarszej latarni morskiej w Japonii, Hatozaki. Płyn dojrzewa w wielu różnych rodzajach beczek, w tym po sherry, burbonie i dębie Mizunara, nadając złożony profil smakowy.;whisky wschodnie;1;Moc:40%
WHISKEY BUSHMILLS 0,7L 40%+2 SZKLANKI        IRLANDIA;105.90;https://alkoholeswiata24.pl/gfx/mini/1582106321.9639.jpg, https://alkoholeswiata24.pl/gfx/1582106321.9639.jpg;0;jest kompozycją trzykrotnie destylowanej whiskey słodowej z delikatną whiskey zbożową. To whiskey o bogatym, pełnym charakteru smaku świeżych owoców i wanilii, z nutą przypraw w finiszu. Whiskey wchodzące w skład Bushmills Original dojrzewają w beczkach minimum 3 lata. Irlandzka whisky w dobrej cenie.;whisky zachodnie;1;Moc:40%
WHISKY HATOZAKI PURE MALT 0,7L 46% JAPONIA;239.00;https://alkoholeswiata24.pl/gfx/mini/1582619887.9124.jpg, https://alkoholeswiata24.pl/gfx/1582619887.9124.jpg;3;Nazwana na cześć najstarszej kamiennej latarni morskiej w Japonii, japońska whisky Hatozaki Pure Malt to słodka, dymna whisky typu blended malt z destylarni Kaikyo. W nosie wypełniają bogate aromaty suszonych owoców, jabłek toffi i letnich kwiatów, a na podniebieniu nuty słodkiego miodu, delikatnego dymu drzewnego i sułtanek.;whisky wschodnie;1;Moc:46%
WHISKEY BUSHMILLS 12YO TEQUILA CASK 52,8% 0,7L PUSZKA;399.00;https://alkoholeswiata24.pl/gfx/mini/1668433495.9405.jpg, https://alkoholeswiata24.pl/gfx/1668433495.9405.jpg;10;Whiskey Bushmills Tequila Cask 12 YO 0,7l 52,8%;whisky zachodnie;1;Moc:52,8%
WHISKY CHITA SINGLE GRAIN 0,7L 43%  JAPONIA;289.90;https://alkoholeswiata24.pl/gfx/mini/1481207116.5207.jpg, https://alkoholeswiata24.pl/gfx/1481207116.5207.jpg;0;Whisky Chita Single Grain 0,7l 43%;whisky wschodnie;1;Moc:43%
WHISKY HATOZAKI 12YO UMESHU CASK FINISH 0,7L 46% JAPONIA;434.90;https://alkoholeswiata24.pl/gfx/mini/1675174233.052.jpg, https://alkoholeswiata24.pl/gfx/1675174233.052.jpg;2;Whisky Hatozaki 12 YO Umeshu Cask Finish 0,7l 46%;whisky wschodnie;1;Moc:46%
WHISKY HIBIKI JAPANESE HARMONY 0,7L 43%  JAPONIA;699.00;https://alkoholeswiata24.pl/gfx/mini/1597303221.3834.jpg, https://alkoholeswiata24.pl/gfx/1597303221.3834.jpg;1;;whisky wschodnie;1;Moc:43%
WHISKEY BUSHMILLS 16YO 0,7L 40%          IRLANDIA;309.00;https://alkoholeswiata24.pl/gfx/mini/1481207408.4423.jpg, https://alkoholeswiata24.pl/gfx/1481207408.4423.jpg;0;;whisky zachodnie;1;Moc:40%
WHISKY KOURO PURE MALT 43% 0,7L;242.00;https://alkoholeswiata24.pl/gfx/mini/1651140971.4385.jpg, https://alkoholeswiata24.pl/gfx/1651140971.4385.jpg;0;;whisky wschodnie;1;Moc:43%
WHISKEY BUSHMILLS 10YO 0,7L 40%  TUBA  IRLANDIA;161.90;https://alkoholeswiata24.pl/gfx/mini/1698240051.221.jpg, https://alkoholeswiata24.pl/gfx/1698240051.221.jpg;5;;whisky zachodnie;1;Moc:40%
WHISKEY BUSHMILLS BLACK 0,7L 40% + 2 SZKLANKI;135.90;https://alkoholeswiata24.pl/gfx/mini/1663768438.8254.jpg, https://alkoholeswiata24.pl/gfx/1663768438.8254.jpg;4;Whiskey Bushmills Black 0,7l 40% + 2 szklankami;whisky zachodnie;1;Moc:40%
WHISKEY BUSHMILLS 10YO 0,7L 40% +SZKL. IRLANDIA;169.90;https://alkoholeswiata24.pl/gfx/mini/1698241950.3132.jpg, https://alkoholeswiata24.pl/gfx/1698241950.3132.jpg;1;WHISKEY BUSHMILLS MALT 10YO 0,7L 40% +SZKL. IRLANDIA;whisky zachodnie;1;Moc:40%
WHISKY PAUL JOHN SINGLE MALT 0,05L 55,2% MINIATURKA;27.90;https://alkoholeswiata24.pl/gfx/mini/1696935738.9746.jpg, https://alkoholeswiata24.pl/gfx/1696935738.9746.jpg;0;Whisky Paul John Single Malt 50ml miniaturka 55,2%;whisky wschodnie;1;Moc:55,2%
WHISKEY BOURBON BLENDED MOTOR 0,5L 40%;54.89;https://alkoholeswiata24.pl/gfx/mini/1677663077.8837.jpg, https://alkoholeswiata24.pl/gfx/1677663077.8837.jpg;10;"produkowana z oryginalnej amerykańskiej receptury z 1930 roku.  ""Bursztynowe złoto"", czyli bourbon charakteryzuje się bogatym smakiem uzupełnione pikantnymi nutami. W składzie znajdziemy co najmniej 51% słodu kukurydzianego. Beczki używane do starzenia są wcześniej wypalane, co wpływa na pikantny aromat trunku.  Bourbon Blended Motor cechuje bursztynowy kolor i elegancki aromat wanilii i cynamonu. W smaku whiskey jest słodka, ale uzupełniona akcentem pikantnych przypraw. . Świetna whiskey na imprezy, 18 nastkę czy dla barmanów. Bourbon Blended Motor zamknięty jest w butelką o pojemności 0,5 litra i mocą 40% ABV.";whisky zachodnie;1;Moc:40%
WHISKY ABERFELDY 21YO SINGLE MALT 40% 0,7L;709.00;https://alkoholeswiata24.pl/gfx/mini/1629270951.9987.jpg, https://alkoholeswiata24.pl/gfx/1629270951.9987.jpg;7;Jeśli kochasz whisky, musisz spróbować whisky Aberfeldy Single Malt.  Aberfeldy jest domową destylarnią słynnej marki Dewar i jest jedyną szkocką gorzelnią whisky zbudowaną przez rodzinę.  Historia destylarni Aberfeldy rozpoczęła się w 1846 roku, kiedy Alexander Dewar postanowił wybudować destylarnię Aberfeldy, aby zapewnić niezawodne dostawy whisky słodowej dla mieszanki Dewara.  Od tego czasu destylarnia rozrosła się z małego sklepu z winem i alkoholami w Szkocji, aby stać się marką o międzynarodowej renomie. Aberfeldy 21 Year Old leżakowała przez 21 lat w beczkach po sherry i bourbonie. Ponad dwie dekady przechowywania dębowych beczek prowadzą do szczególnej złożoności i obfitości, drewno jest wyczuwalne, ale nie zagłusza miękkiego charakteru.  Nazywana jest także Złotym Dramem. Ziemia, na której została zbudowana destylarnia, słynie ze złóż złota, a Pitilie Burn, z którego czerpana jest woda, jest bogata w złoża złota. Aberfeldy to klasyczna, owocowa whisky, o pełnym miodowym aromacie w każdej kropli, a jednocześnie okrągła i łatwo dostępna w smaku.;whisky zachodnie;1;Moc:40%
WHISKEY PIKESVILLE STRAIGHT RYE 0,7L 55%;400.00;https://alkoholeswiata24.pl/gfx/mini/1663682263.7552.jpg, https://alkoholeswiata24.pl/gfx/1663682263.7552.jpg;3;Whiskey Pikesville Straight Rye 0,7l 55%;whisky zachodnie;1;Moc:55%
WHISKEY BOURBON EVAN WILLIAMS 0,7L 43% USA;84.89;https://alkoholeswiata24.pl/gfx/mini/1582105873.6722.jpg, https://alkoholeswiata24.pl/gfx/1582105873.6722.jpg;0;, uznawana za drugą najlepiej sprzedającą się whiskey bourbon w Stanach Zjednoczonych i na świecie. Powstaje na bazie zacieru z kukurydzy (75%), żyta (13%) i jęczmienia (12%). Evan Williams starzony jest w dębowych beczkach przez okres dłuższy niż jest to wymagane przez prawo. która wyróżnia się gładkością, bogactwem i  . Został nazwany na cześć Evana Williamsa, który otworzył pierwszą gorzelnię w Kentucky nad brzegiem rzeki Ohio w 1783 roku. Ponadprzeciętna whiskey, odpowiednia dla miłośników bourbon whiskey jak i amatorów Aromat : Słodycz karmelu, wanilii i kukurydzy. Akcent dębiny i mięty. : Słodki i harmonijny. Głównie wanilia i karmel, delikatny akcent dębu. : Średnio długi i delikatnie wytrawny, dąb i nuta zió Jak pić whiskey bourbon Evan Williams? , ale przez jego lekki charakter doskonale komponuje się w drinkach.  Poniżej przykłady koktajli z wykorzystaniem Evan Williams: - 60 ml bourbonu Evan Williams - piwo imbirowe  - ćwiartka cytryny Wlej bourbon do szklanki typu highball, dopełnij piwem imbirowym, udekoruj cytryną. EVAN & SEVEN - 60 ml bourbonu Evan Williams - napój gazowany cytrynowo-limonkowy - lód Napełnij szklankę lodem, wlej bourbon, dopełnij napojem.  EVAN & APPLE - 60 ml bourbonu Evan Williams - 20 ml soku jabłkowy  - piwo imbirowe Wymieszaj bourbon z sokiem jabłkowym, dopełnij piwem imbirowym. CLASSIC MANHATTAN - 60 ml bourbonu Evan Williams - 90-120 ml  - 2-3 krople  - wiśnia do dekoracji;whisky zachodnie;1;Moc:43%
LIKIER FIREBALL 0,7L 33%;107.99;https://alkoholeswiata24.pl/gfx/mini/1538722584.4538.jpg, https://alkoholeswiata24.pl/gfx/1538722584.4538.jpg;3;;whisky zachodnie;1;Moc:33%
WHISKEY BOURBON EAGLE RARE 10YO SINGLE BARREL 0,7L 45% USA;279.98;https://alkoholeswiata24.pl/gfx/mini/1672322398.3177.jpg, https://alkoholeswiata24.pl/gfx/1672322398.3177.jpg;7;Kentucky Staight Bourbon Whiskey Eagle Rare 10 YO 0,7l 45%;whisky zachodnie;1;Moc:45%
WHISKEY JACK DANIEL'S APPLE 35% 0,7L;101.50;https://alkoholeswiata24.pl/gfx/mini/1586940195.9265.jpg, https://alkoholeswiata24.pl/gfx/1586940195.9265.jpg;6;WHISKY JACK DANIEL'S APPLE 35% 0,7L Old No 7. z likierem jabłkowym. Tak powstały blend zachwyca swoim orzeźwiającym smakiem jabłek i słodkimi nutami miodu, wanilii i migdałów.  Trunek idealnie nadaje się do drinków, jak i do picia samodzielnie na kostkach lodu.;whisky zachodnie;1;Moc:35%
WHISKEY BOURBON ELIJAH CRAIG 12YO BARREL PROOF BATCH C921 0,7L 60,1%;489.00;https://alkoholeswiata24.pl/gfx/mini/1663680558.861.jpg, https://alkoholeswiata24.pl/gfx/1663680558.861.jpg;0;Whiskey Bourbon Elijah Craig 12 YO Barrel Proof Batch C921 0,7l 60,1%;whisky zachodnie;1;Moc:60,1%
WHISKEY BOURBON REBEL DISTILLER'S COLLECTION SINGLE BARREL 56,5% 0,75L;299.00;https://alkoholeswiata24.pl/gfx/mini/1648645580.346.jpg, https://alkoholeswiata24.pl/gfx/1648645580.346.jpg;0;;whisky zachodnie;1;Moc:56,5%
WHISKEY BOURBON ELIJAH CRAIG 23YO SINGLE BARREL 0,7L 45%;2989.99;https://alkoholeswiata24.pl/gfx/mini/1685608057.9923.jpg, https://alkoholeswiata24.pl/gfx/1685608057.9923.jpg;1;Whiskey Bourbon Elijah Craig 23 years old Single Barrel  produkowana w największej niezależnej, rodzinnej destylarni w Ameryce-  . To wyjątkowa whisky, która   w zwęglonych beczkach po bourbonie. Wydana w limitowanej ilości w wersji single barrel. Zabutelkowana z mocą 45% abv. Każda butelka posiada ręcznie zapisany numer beczki i datę butekowania. Tak długi czas leżakowania bourbonu jest rzadko spotykany, dlatego jest to propozycja dla koneserów, którzy w pełni docenią jej charakter.  23 letnia bourbon whiskey Elijah Craig - noty degustacyjne : Bogaty, mocne nuty dębu, suszone owoce, wanilia, akcent skórki cytrusowej.  : Miód, wanilia, tytoń, dąb.  : Długi i wytrawny. Orzechy, prażone migdały, wanilia, dąb, skóra.;whisky zachodnie;1;Moc:45%
WHISKEY BOURBON EVAN WILLIAMS WHITE BOTTLED-IN-BOND 0,7L 50% USA;124.89;https://alkoholeswiata24.pl/gfx/mini/1663659407.7793.jpg, https://alkoholeswiata24.pl/gfx/1663659407.7793.jpg;7;Whiskey amerykańska bourbon Evan Williams White Bottled-in-bond 0,7l 50% Bourbon produkowany w rodzinnej firmie Heaven Hill Destilleries mieszczącej się w stanie Kentucky, działającej od 1935 roku. Firma plasuje się na siódmym co do wielkości dostawcy alkoholu w USA i jest drugim największym producentem amerykańskiej whiskey. Jak produkowane jest Evan Williams Bottled-in-bond 0,7 50%? Amerykańska bourbon whiskey produkowana jest z zacieru powstałego z kukurydzy (75%), żyta (13%) i jęczmienia (12%). Dojrzewana jest w nowych, wypalanych beczkach z białego dębu Jakie cechy ma i jak smakuje amerykański bourbon whiskey Evan Williams Bottled-in-bond 0,7l? : Słodki karmel, wanilii, akcent dębu.  : Świeży i słodki. Owoce cytrusowe z wanilią i nutą pieprzu.  : Długi i wytrawny.;whisky zachodnie;1;Moc:50%
WHISKEY BOURBON BUFFALO TRACE 0,7L 40% USA;112.00;https://alkoholeswiata24.pl/gfx/mini/1481206517.9997.jpg, https://alkoholeswiata24.pl/gfx/1481206517.9997.jpg;10;Flagowy trunek destylarni, który powstał w hołdzie dla zamieszkujących tutaj przed wiekami stad potężnych bizonów oraz niezłomnego ducha i wielkiej odwagi pionierów kolonizujących tereny obecnego stanu Kentucky. Starannie destylowany i dojrzewany przez okres 8-9 lat jest bogaty, złożony i gładki w smaku. Jest bourbonem typu small batch, skomponowanym z ok 30-40 starannie wyselekcjonowanych beczek a następnie ręcznie butelkowany. W tej intensywnie bursztynowej whisky wyczuwamy aromaty wanilii, mięty i melasy. W ustach przyjemna słodycz z akcentami brązowego cukru, przypraw i wyczuwalnymi nutami dębiny , toffi, ciemnych owoców i anyżu. Finisz jest długi, gładki z wyraźnie wyczuwalną głębią. Wypróbuj wyśmienitą Whisky Burbon Buffalo Trace w butelce 0,7 litra o zawartości alkoholu 40%. To bardzo dobry wybór nie tylko dla smakoszy whiskey. Zobacz również inne dostępne kategorie oraz produkty w naszym sklepie.;whisky zachodnie;1;Moc:40%
WHISKY PAUL JOHN SINGLE MALT BRILLANCE 0,05L 46% MINIATURKA;24.00;https://alkoholeswiata24.pl/gfx/mini/1696935279.6936.jpg, https://alkoholeswiata24.pl/gfx/1696935279.6936.jpg;0;Whisky Paul John Single Malt Brillance 50ml miniaturka;whisky wschodnie;1;Moc:46%
WHISKY PAUL JOHN SINGLE MALT CHRISTMAS EDITION 2023 0,7L 46% INDIE;369.00;https://alkoholeswiata24.pl/gfx/mini/1699885538.4921.jpg, https://alkoholeswiata24.pl/gfx/1699885538.4921.jpg;2;Whisky Paul John Single Malt Christmas Edition 2023   to szósta edycja indyjskiej whisky wydawanej corocznie w okresie Świąt Bożego Narodzenia. Świetna na prezent pod choinkę dla koneserów whisky.  Wytwarzana z sześciorzędowego jęczmienia, destylowany podwójnie w miedzianym alembiku. Leżakowana w beczkach po bourbonie i finiszowana w beczce po porto Tawny Single Vintage Colheita. Butelkowana bez filtracji na zimno i w naturalnym kolorze z mocą 46% ABV.  Whisky Paul John Single Malt Christmas Edition 2023 produkowana jest w limitowanej ilości. Doskonale odzwierciedla charakter regionu Goa, z którego pochodzi. Zamknięta w eleganckiej tubie ze świątecznym motywem.  Whisky Paul John Single Malt Christmas Edition 2023- noty degustacyjne : Krem waniliowy, ciemna czekolada, suszone owoce. : Głęboki, słodki, nuty dębu, mokka z karmelem, wanilia i akcent przypraw. : Bogaty i długi z niuansami owoców.;whisky wschodnie;1;Moc:46%
WHISKY PAUL JOHN SINGLE MALT CHRISTMAS EDITION 2022 0,7L 46% INDIE;319.98;https://alkoholeswiata24.pl/gfx/mini/1667384299.1228.jpg, https://alkoholeswiata24.pl/gfx/1667384299.1228.jpg;2;Whisky Paul John Single Malt Christmas Edition 2022 0,7l 46% Indie;whisky wschodnie;1;Moc:46%
WHISKEY BUSHMILLS BLACK 0,7L 40% TUBA        IRLANDIA;124.89;https://alkoholeswiata24.pl/gfx/mini/1614977526.7643.jpg, https://alkoholeswiata24.pl/gfx/1614977526.7643.jpg;0;WHISKEY BUSHMILLS BLACK 0,7L 40% TUBA IRLANDIA Bushmills Black Bush jest produkowany w Irlandii. Oparta jest w 75% na whisky słodowej, która dojrzewała przez osiem do dziesięciu lat w beczkach po sherry Oloroso. Pozostałe 25% stanowią inne destylaty zbożowe. Aromat Aromat składa się głównie z pieczonych jabłek, rodzynek, kakao, jęczmienia, winogron i pikantnego słodu. Smak Bushmills Black Bush Irish Whisky jest bardzo mocny. W tym przedziale cenowym jego smak jest prawdziwym zwycięzcą. Ślady gałki muszkatołowej, czekolady, rodzynek, orzechów, czerwonego wina, słodu i sherry. Prawdziwa przyjemność aż do finiszu, który jest bardzo długi i gładki z blaknącym odcieniem słodu. Nagrody Bush Bush's Black Bush zdobył kilka nagród. Otrzymał złoty medal na Międzynarodowym Konkursie Wina i Ducha 2013 w kategorii Irish Whisky Blended. Został również nagrodzony tytułem „Master” przez The Spirits Business w irlandzkiej kategorii Blended Premium w 2013 roku. Podczas Wizards of Whisky Awards 2014 otrzymał srebrny medal w kategorii Irish Whisky.;whisky zachodnie;1;Moc:40%
WHISKY ABERFELDY 18YO NAPA VALLEY WINE CASK 43% 0,7L;400.00;https://alkoholeswiata24.pl/gfx/mini/1700475823.7251.jpg, https://alkoholeswiata24.pl/gfx/1700475823.7251.jpg;2;Whisky Aberfeldy 18 YO Napa Valley Wine Cask Limitowana edycja szkockiej whisky single malt  . Whisky dojrzewała przez 18 lat w beczkach ponownego napełnienia, a następnie finiszowała w beczkach po czerwonym winie Cabernet Sauvignon z regionu Napa Valley. To najbardziej znany region winiarski w Kalifornii, który doceniany jest na całym świecie za bogaty, intensywnie owocowy smak wina. Whisky zabutelkowana została z mocą 43% ABV.  18-letnie whisky Aberfeldy Napa Valley Wine Cask : Czerwone jagody, zielone jabłko, miód, nuty kwiatów.  : Bogaty i owocowy, dżem truskawkowy, łagodne taniny, miód, cynamon.  : Aksamitny i łagodny.;whisky zachodnie;1;Moc:43%
WHISKEY BUSHMILLS BLACK 0,7L 40% + 2 SZKLANKI;135.90;https://alkoholeswiata24.pl/gfx/mini/1663768438.8254.jpg, https://alkoholeswiata24.pl/gfx/1663768438.8254.jpg;4;Whiskey Bushmills Black 0,7l 40% + 2 szklankami;whisky zachodnie;1;Moc:40%
WHISKY NIKKA 12YO  0,7L 43% JAPONIA;799.00;https://alkoholeswiata24.pl/gfx/mini/1537266275.8168.jpg, https://alkoholeswiata24.pl/gfx/1537266275.8168.jpg;0;;whisky wschodnie;1;Moc:43%
WHISKEY BUSHMILLS BLACK 0,7L 40%             IRLANDIA;110.50;https://alkoholeswiata24.pl/gfx/mini/1481207407.9896.jpg, https://alkoholeswiata24.pl/gfx/1481207407.9896.jpg;10;Bushmills Black Bush jest produkowany w Irlandii. Oparta jest w 75% na whisky słodowej, która dojrzewała przez osiem do dziesięciu lat w beczkach po sherry Oloroso. Pozostałe 25% stanowią inne destylaty zbożowe. Aromat Aromat składa się głównie z pieczonych jabłek, rodzynek, kakao, jęczmienia, winogron i pikantnego słodu. Smak Bushmills Black Bush Irish Whisky jest bardzo mocny. W tym przedziale cenowym jego smak jest prawdziwym zwycięzcą. Ślady gałki muszkatołowej, czekolady, rodzynek, orzechów, czerwonego wina, słodu i sherry. Prawdziwa przyjemność aż do finiszu, który jest bardzo długi i gładki z blaknącym odcieniem słodu. Nagrody Bush Bush's Black Bush zdobył kilka nagród. Otrzymał złoty medal na Międzynarodowym Konkursie Wina i Ducha 2013 w kategorii Irish Whisky Blended. Został również nagrodzony tytułem „Master” przez The Spirits Business w irlandzkiej kategorii Blended Premium w 2013 roku. Podczas Wizards of Whisky Awards 2014 otrzymał srebrny medal w kategorii Irish Whisky.;whisky zachodnie;1;Moc:40%
WHISKY MARS ASAGI MADARA 8YO BLENDED 0,7L 48%;549.00;https://alkoholeswiata24.pl/gfx/mini/1698228401.8605.jpg, https://alkoholeswiata24.pl/gfx/1698228401.8605.jpg;2;Whisky Mars Asagi Madara 8 YO Blended;whisky wschodnie;1;Moc:48%
WHISKEY BUSHMILLS BLACK 0,05L 40% MINIATURKA IRLANDIA;14.50;https://alkoholeswiata24.pl/gfx/mini/1644849555.0992.jpg, https://alkoholeswiata24.pl/gfx/1644849555.0992.jpg;10;WHISKEY BUSHMILLS BLACK 0,05L 40% IRLANDIA;whisky zachodnie;1;Moc:40%
WHISKY KURAYOSHI PURE MALT SHERRY 0,7L 43% JAPONIA;464.01;https://alkoholeswiata24.pl/gfx/mini/1531128762.1513.jpg, https://alkoholeswiata24.pl/gfx/1531128762.1513.jpg;2;WHISKY KURAYOSHI PURE MALT SHERRY 0,7L 43% JAPONIA;whisky wschodnie;1;Moc:43%
WHISKEY BUSHMILLS AMERICAN OAK BOURBON FINISH 40% 0,7L;89.00;https://alkoholeswiata24.pl/gfx/mini/1664443277.6081.jpg, https://alkoholeswiata24.pl/gfx/1664443277.6081.jpg;0;Whiskey Bushmills American Oak Bourbon Finish 0,7l 40%;whisky zachodnie;1;Moc:40%
WHISKY KURAYOSHI PURE MALT 0,7L 43% JAPONIA;384.01;https://alkoholeswiata24.pl/gfx/mini/1531128743.3688.jpg, https://alkoholeswiata24.pl/gfx/1531128743.3688.jpg;2;Kurayoshi japońska marka whisky, produkowana w zakładzie Matsui Shuzou w dzielnicy Tottori, na północny zachód od Kioto, założonym w 1910 roku. Podobnie jak kilka innych japońskich mieszanek, łączy whisky słodową ze Szkocji z japońską whisky. Nie jest to rzadka praktyka, a dokładny podział whisky pozostaje nieujawniony. Whisky dojrzewająca w beczce po burbonie. Głębokie złoto. W nosie zachowuje równowagę między dębowym i słodkim słodem, z wyczuwalną delikatną owocowością oraz chlebowymi nutami i nutami popcornu. Subtelny aromat gotowanych owoców sadu (jabłko / gruszka), odrobina wanilii i szczypta korzennego ciepła, z średnio wytrawnym, oleistym finiszem i niską zawartością torfu.;whisky wschodnie;1;Moc:43%
WHISKY ABERFELDY 16 YO SINGLE MALT 40% 0,7L;324.90;https://alkoholeswiata24.pl/gfx/mini/1611650987.8216.jpg, https://alkoholeswiata24.pl/gfx/1611650987.8216.jpg;9;Destylarnia Aberfeldy została zbudowana na lądzie słynącym ze złóż złota i czerpie wodę z Pitilie Burn, pokrytego aluwialnym złotem.  Wszystkie whisky Aberfeldy są opatrzone oświadczeniami o wieku, do ich produkcji wykorzystuje się najlepsze dębowe beczki, które dojrzewają pod okiem Malt Master, Stephanie MacLeod. estylarnia Aberfeldy wypuściła na rynek nowy 16-letni Highland Single Malt o bogatym, dobrze zbalansowanym profilu.  W nosie wyczuwalny jest miód, cytrusy i korzenne goździki.  W ustach wyczuwalne nuty prażonego dębu, keksa i gorzkiej czekolady.;whisky zachodnie;1;Moc:40%
