name;price;image_url;quantity;description;category;tax;power
WHISKY GLEN SPEY 12YO FAUNA & FLORA 43% 0,7L;324.90;https://alkoholeswiata24.pl/gfx/mini/1659087652.6937.jpg, https://alkoholeswiata24.pl/gfx/1659087652.6937.jpg;3;Limitowana szkocka whisky single malt produkowana w znanym regionie i uwielbianym regionie Speyside w destylarni Glen Spey działającej od 1878 roku. Należy do wyjątkowej serii Fauna & Flora powstałej, aby zwrócić uwagę konsumentów na mniejsze, mniej znane szkockie destylarnie, które zachowują najwyższą jakość produkcji. Glen Spey 12yo dołączył do serii w 2001 roku.  Whisky charakteryzuje się lekkością i świeżością, dlatego będzie doskonałym wyborem dla początkujących koneserów. Lekkie owocowe nuty wzbogacone są delikatnymi, dymnymi akcentami i otulającą, gładką słodyczą.  : Łagodny i przyjemny. Owoce, głównie winogrona, miód z lekkim akcentem dymnym i zwęglonym drewnem.  : Rozgrzewający, słodka wanilia i karmel z delikatną nutą kwasowości.  : Średnio długi, wytrawny. Posmak mlecznej czekolady i kokosa.;whisky zachodnie;1;Moc:43%
WHISKY GLEN SCOTIA VICTORIANA SINGLE MALT 0,7L 54,2% SZKOCJA;439.00;https://alkoholeswiata24.pl/gfx/mini/1687166442.41.jpg, https://alkoholeswiata24.pl/gfx/1687166442.41.jpg;7;Whisky Glen Scotia Victoriana Single Malt   malt produkowana w  . Powstała na wzór tradycyjnego wiktoriańskiego stylu whisky i nawiązuje do czasów kiedy miasteczko Campbeltown było nazywane światową stolicą produkcji złotego trunku.  pierwszego i ponownego napełnienia po bourbonie i finiszowała w wypalanych beczkach dębowych i w beczkach po  . Zabutelkowana z mocą cask strength 54,2% abv bez filtracji i bez koloryzowania.  Glen Scotia Victoriana Single Malt whisky - noty degustacyjne : Bogaty i słodki, creme brulee, karmel, owoce, nura dębu, przypraw i wędzonki.  : Początkowo słodki, następnie lekko wytrawny. Karmel, czarna porzeczka, rozgrzewające przyprawy, cynamon, zioła, wanilia, nuta dębu i dymu. : Kakao, gorzka czekolada, ciemne owoce, przyprawy.;whisky zachodnie;1;Moc:54,2%
WHISKY GLEN SCOTIA FESTIVAL RELEASE 2023 0,7L 54,7% SZKOCJA;399.00;https://alkoholeswiata24.pl/gfx/mini/1689237478.4153.jpg, https://alkoholeswiata24.pl/gfx/1689237478.4153.jpg;4;Whisky Glen Scotia Festival Release 2023 to szkocka   wydana w limitowanej ilości na corocznym festiwalu  Rocznik 2023 ukazał whisky intrygująca z charakterystycznym dla Campbeltown dymnym charakterem z nutą soli morskiej. Starzona przez 11 lat w beczkach po bourbonie i finiszowana przez 12 miesięcy w beczkach po białym porto. Zabutelkowana z mocą 54,7% abv bez filtracji na zimno, niekoloryzowana. To świetna whisky dla kolekcjonerów jak i koneserów torfowo-owocowych whisky.  Whisky Glen Scotia Festival Release 2023 - noty degustacyjne : Rozgrzewające, lekko pikantne owoce pestkowe, duszone brzoskwinie z goździkami, trawa cytrynowa, niuanse mineralne.   : Melasa, karmel, suszone śliwki i figi, woskowane drewno, drzewo sandałowe.  :  Długi i aromatyczny.;whisky zachodnie;1;Moc:54,7%
WHISKY GLEN SCOTIA FESTIVAL RELEASE 2022 0,7L 56,5% SZKOCJA;369.00;https://alkoholeswiata24.pl/gfx/mini/1652867167.0174.jpg, https://alkoholeswiata24.pl/gfx/1652867167.0174.jpg;0;;whisky zachodnie;1;Moc:56,5%
WHISKY GLENALLACHIE 10YO 0,7L 57,1%  SINGLEMALT;319.00;https://alkoholeswiata24.pl/gfx/mini/1537270751.6178.jpg, https://alkoholeswiata24.pl/gfx/1537270751.6178.jpg;0;Wspaniale jest zobaczyć ożywienie tej destylarni, która do tej pory była w dużej mierze wykorzystywana w mieszankach i niezależnych butelkach. Ta whisky dojrzewa w mieszance dębu amerykańskiego, Oloroso, Pedro Ximénez i beczek z pierwszego tłoczenia. Rezultatem jest potężny i głęboko złożony dramat. Glenallachie Cask Strength serwuje rozgrzewające nuty cytrusów, suszonych owoców, imbiru, miodu wrzosowego, słodu, wiśniowego dębu, intensywnego toffi (cecha Glenallachie) i tłoczonych kwiatów. Butelkowane  57,1% i bez filtracji chłodniczej lub sztucznego zabarwienia. Świetny początek od Glenallachie.;whisky zachodnie;1;Moc:57,1%
WHISKY GLEN SCOTIA DOUBLE CASK SINGLE MALT 0,7L 46% SZKOCJA;259.90;https://alkoholeswiata24.pl/gfx/mini/1664795800.9489.jpg, https://alkoholeswiata24.pl/gfx/1664795800.9489.jpg;4;Whisky szkocka Glen Scotia Double Cask Single Malt 0,7l 46%;whisky zachodnie;1;Moc:46%
WHISKY GLEN SCOTIA CAMPBELTOWN HARBOUR 0,7L 40% SZKOCJA;159.90;https://alkoholeswiata24.pl/gfx/mini/1538722505.4704.jpg, https://alkoholeswiata24.pl/gfx/1538722505.4704.jpg;8;;whisky zachodnie;1;Moc:40%
WHISKY GLEN SCOTIA 21YO SINGLE MALT 0,7L 46% SZKOCJA;1999.00;https://alkoholeswiata24.pl/gfx/mini/1689232338.4502.jpg, https://alkoholeswiata24.pl/gfx/1689232338.4502.jpg;1;"Whisky Glen Scotia 21 YO Single Malt , wydana aby wypełnić lukę między 18 letnią i 25 letnią whisky z podstawowej oferty. . Whisky starzona była w wyselekcjonowanych beczkach po bourbonie ponownego napełnienia i typu hogshead z amerykańskiego dębu, a ostatnie sześć miesięcy spędziła w beczkach pierwszego napełnienia po sherry Oloroso. Ostatni okres dojrzewania dodał wspaniałych kwiatowo-owocowych nut smakowych, tworząc  . Zamknięta została z mocą 46% abv bez koloryzacji ani filtracji na zimno.  21 letnia Glen Scotia to wyrafinowana i elegancka whisky, którą doceni każdy koneser. Zamknięta w pięknej butelce, do której zostało dołączone pudełko ekspozycyjne w kolorze granatu ze złotymi zdobieniami. Idealna propozycja na prezent na ""oczko"" lub dla kogoś wyjątkowego. Whisky Glen Scotia 21 years old - noty degustacyjne : Czerwone jabłko, wiśnie, nuty pieprzu i soli.  : Pieczone czerwone jabłko, rodzynki, goździki, anyż, cynamon, kremowa wanilia, toffi, nuty morskiej soli.  : Długi i złożony, nuta soli morskiej i sherry.";whisky zachodnie;1;Moc:46%
WHISKY GLEN SCOTIA 15YO SINGLE MALT 0,7L 46% SZKOCJA;299.90;https://alkoholeswiata24.pl/gfx/mini/1570440200.493.jpg, https://alkoholeswiata24.pl/gfx/1570440200.493.jpg;7;;whisky zachodnie;1;Moc:46%
WHISKY GLENALLACHIE 10YO BATCH 7 0,7L 56,8%  SINGLEMALT;439.00;https://alkoholeswiata24.pl/gfx/mini/1652872847.1043.jpg, https://alkoholeswiata24.pl/gfx/1652872847.1043.jpg;0;Whisky Glenallanchie 10YO Batch 7 0,7l 56,8% Whisky Glenallanchie 10YO Batch 7;whisky zachodnie;1;Moc:56,8%
WHISKY GLENALLACHIE 15YO 0,7L 46%  SINGLEMALT;489.00;https://alkoholeswiata24.pl/gfx/mini/1634758648.0912.jpg, https://alkoholeswiata24.pl/gfx/1634758648.0912.jpg;3;"GlenAllachie 15 Year Old to naprawdę coś wyjątkowego. Opisywany przez Master Distillera, Billy'ego Walkera, jako ""Klejnot w ich koronie"", ten single malt dojrzewa w Pedro Ximénez i Oloroso Puncheons and Hogsheads, zanim butelkuje się w 46%.";whisky zachodnie;1;Moc:46%
WHISKY GLENALLACHIE 2007 15YO M&P CASK 800184 0,7L 58,3%;789.00;https://alkoholeswiata24.pl/gfx/mini/1696513732.4398.jpg, https://alkoholeswiata24.pl/gfx/1696513732.4398.jpg;2;Szkocka whisky Glenallachie wydana w wersji Single Cask specjalnie dla M&P. Wydestylowana w 2007 roku i zabutelkowana w sierpniu 2022 roku. Nr beczki: 800184. Whisky leżakowała w beczce po sherry Oloroso Puncheon. Wydana w zaledwie 712 egzemplarzach! Wyjątkowa whisky dla koneserów i kolekcjonerów lub na niezapomniany prezent. Zabutelkowana z mocą 58,3% ABV bez filtracji na zimno, niekoloryzowana.  : Intensywny, owocowy z nutą słodyczy.  : Suszone owoce, rodzynki, figi, kawa, ciemna czekolada, toffi, śliwki. : Długi i słodki.;whisky zachodnie;1;Moc:58,3%
WHISKY GLENALLACHIE 13YO RIOJA WINE CASK FINISH 0,7L 48%  SINGLEMALT;399.00;https://alkoholeswiata24.pl/gfx/mini/1625477876.2121.jpg, https://alkoholeswiata24.pl/gfx/1625477876.2121.jpg;0;WHISKY GLENALLACHIE 13YO RIOJA WINE CASK FINISH 0,7L 48% SINGLEMALT GlenAllachie  niedawno zaprezentowała swoją serię dziewiczych  beczek na wino  . Trzy whisky single malt dojrzewające w beczkach po bourbonie, a następnie finiszowane przez prawie dwa lata w winnych beczkach wybranych przez mistrza gorzelnika Billy'ego Walkera: beczka wina Grattamacco, wina Sauternes, wina Rioja.  wykończona w średnio prażonych  z  z Rioja.  Nos:  dużo jaśniejszy i lepszy niż Grattamacco. Więcej pikanterii, ale jakoś słodycz również wydaje się bardziej zintegrowana. Anyż i pieprz, z lekkim kwiatowym i cytrusowym wydźwiękiem (skórka pomarańczowa). Słodkie jagody, czerwone pomarańcze i ciemny miód i toffi. Czerwone powidła śliwkowe na lekko przypalonej grzance. Usta:  dość bogate, bardziej na czerwonych jagodach i skórkach pomarańczy obok anyżu i cynamonu. Być może beczka po winie dla miłośników beczek po sherry, gdyby nie skórki winogron i wytrawność orzechów włoskich, a także trochę kawy i znowu odrobina goździków. Zabawna mieszanka ciemniejszych i jaśniejszych elementów. Finisz:  średni, na sułtankach, lekki ogień pieprzowy i toffi.;whisky zachodnie;1;Moc:48%
WHISKY GLENALLACHIE 13YO 2009 M&P SINGLE CASK 3714 0,7L 58,9%;759.00;https://alkoholeswiata24.pl/gfx/mini/1664197212.3851.jpg, https://alkoholeswiata24.pl/gfx/1664197212.3851.jpg;2;Whisky Glenallachie 13 YO 2009 M&P Single Cask 3714 0,7l 58,9%;whisky zachodnie;1;Moc:58,9%
WHISKY GLENALLACHIE 12YO WINE CASK FINISH 0,7L 48%  SINGLEMALT;369.00;https://alkoholeswiata24.pl/gfx/mini/1625477354.2007.jpg, https://alkoholeswiata24.pl/gfx/1625477354.2007.jpg;1;GlenAllachie  niedawno zaprezentowała swoją serię dziewiczych  beczek na wino  . Trzy whisky single malt dojrzewające w beczkach po bourbonie, a następnie finiszowane przez prawie dwa lata w winnych beczkach wybranych przez mistrza gorzelnika Billy'ego Walkera: beczka wina Grattamacco, wina Sauternes, wina Rioja.  wykończone w średnio prażonych beczkach z francuskiego dębu, w których wcześniej znajdowało się Sauternes,  regionu Bordeaux we Francji.  z przodu słodki ananas, z brzoskwiniami z puszki i miodem. Trochę jaśniejszych nut cytrusowych w drugiej fali, a także świeżych wiórków dębowych i cynamonu, które nieco łagodzą owocowość. Po chwili trochę różowego grejpfruta i ładna nuta kwiatu pomarańczy.  znów jest ananasowo-słodka morela, a także lekko tropikalna nuta różowych grejpfrutów. Ale to nie wszystkie owoce. Kandyzowany imbir, miód wrzosowy i odrobina miętowej świeżości dodają złożoności. Skórki z cytryny. Na końcu subtelne ciemniejsze nuty cynamonu, gałki muszkatołowej i brązowego cukru.  średni, z większą ilością miodu i cynamonu.;whisky zachodnie;1;Moc:48%
WHISKY GLENALLACHIE 12YO PEDRO XIMENEZ 0,7L 48%  SINGLEMALT;334.90;https://alkoholeswiata24.pl/gfx/mini/1570190767.3833.jpg, https://alkoholeswiata24.pl/gfx/1570190767.3833.jpg;0;Alkohol online – whisky  Ten bogaty słód mahoniowy dojrzewa od ponad dziesięciu lat w beczkach z amerykańskiego drewna dębowego.  Dodatkowe dojrzewanie w bogato przyprawionych beczkach po Pedro Ximenez wzbogaca smak, tworząc słodszą, bardziej owocową whisky.  Beczki są regularnie monitorowane, aby zapewnić idealną równowagę między naszym single malt a soczystym sherry deserowym.  Naturalny kolor, niefiltrowany i butelkowany w 48%. KOLOR:  NOS:  SMAK:;whisky zachodnie;1;Moc:48%
WHISKY GLENALLACHIE 12YO MOSCATEL 0,7L 48% SINGLEMALT;364.01;https://alkoholeswiata24.pl/gfx/mini/1696512567.8239.jpg, https://alkoholeswiata24.pl/gfx/1696512567.8239.jpg;5;Whisky Glenallachie 12YO Moscatel 2023 Szkocka 12-letnia whisky single malt Glenallachie wydana w 2023 roku wyłącznie na rynek europejski. Starzona przez 8 lat w beczkach z dębu amerykańskiego, a kolejne 42 miesiące leżakowała w beczkach po portugalskim winie Moscatel. Charakteryzuje się mocno owocowym bukietem smakowym. Zabutelkowana bez filtracji na zimno, niebarwiona z mocą 48% ABV.  Szkocka 12-letnia whisky Glenallachie Moscatel 2023 : Kwiat pomarańczy, miód wrzosowy, cytrusy, grejpfrut i toffi. : Ciemna czekolada, winogrono, śliwki. Następnie owoce sadu, miód. : Nuty karmelu i imbiru.;whisky zachodnie;1;Moc:48%
WHISKY GLENALLACHIE 12YO 0,7L 46%  SINGLEMALT;319.90;https://alkoholeswiata24.pl/gfx/mini/1611650530.1005.jpg, https://alkoholeswiata24.pl/gfx/1611650530.1005.jpg;5;.;whisky zachodnie;1;Moc:46%
WHISKY GLENALLACHIE 11YO PX SHERRY WOOD FINISH 0,7L 48% SINGLEMALT;388.00;https://alkoholeswiata24.pl/gfx/mini/1646313956.0429.jpg, https://alkoholeswiata24.pl/gfx/1646313956.0429.jpg;0;;whisky zachodnie;1;Moc:48%
WHISKY GLENALLACHIE 10YO BATCH 9 0,7L 58,1% SINGLE MALT;349.90;https://alkoholeswiata24.pl/gfx/mini/1684935759.2445.jpg, https://alkoholeswiata24.pl/gfx/1684935759.2445.jpg;1;Whisky Glenallachie 10 years old Batch 9 single malt . Niezwykła whisky starzona jest przez 10 lat w beczkach po sherry Pedro Ximenez i Oloroso oraz Puncheons, z dodatkiem beczki pierwszego napełnienia po winie Rioja. Butelkowana jest w pełnej mocy beczki 58,1% abv. Whisky bez filtracji na zimno, niekoloryzowana. W smaku i aromacie złożona i bogata.  10 letnia whisky Glenallachie Batch 9 - noty degustacyjne : Śliwki, rodzynki, czerwone owoce, cynamon, miód, imbir. : Kawa, ciemna czekolada, cynamon, miód, syrop figowy, melasa, imbir. : Długi, zbalansowany, dojrzałe śliwki, toffi i skórka pomarańczowa.;whisky zachodnie;1;Moc:58,1%
WHISKY GLENALLACHIE 10YO BATCH 8 0,7L 57,2% SINGLE MALT;399.90;https://alkoholeswiata24.pl/gfx/mini/1672323219.8698.jpg, https://alkoholeswiata24.pl/gfx/1672323219.8698.jpg;6;;whisky zachodnie;1;Moc:57,2%
WHISKY GLENALLACHIE 2008 M&P CASK 6912 0,7L 57,4%;689.00;https://alkoholeswiata24.pl/gfx/mini/1696840095.1544.jpg, https://alkoholeswiata24.pl/gfx/1696840095.1544.jpg;0;Whisky Glenallachie 2008 M&P Cask 6912 Glenallachie 2008 M&P Cask 6912 to szkocka whisky single malt z regionu Speyside. Należy do serii M&P Collection Club. Wydestylowana w 2008 roku, dojrzewała przez 15 lat w beczkach z amerykańskiego białego dębu Chinquapin nr 6912. Beczka z tego dębu nadaje whisky niezwykłej słodyczy ale i pikantności, co sprawia, że trunek ma zdecydowany i wyraźny charakter. Zabutelkowana w kwietniu 2023 roku z mocą 57,4% ABV w naturalnym kolorze, niefiltrowana.  To wyjątkowa, limitowana whisky single cask wydana w zaledwie 264 egzemplarzach.  Whisky Glenallachie 2008 M&P Cask 6912 - jak smakuje? : Mleczna czekolada, miód wrzosowy, anyż, cynamon, kawa, migdały. : Imbir, miód, czarny pieprz, orzechy laskowe, cynamon, wanilia.  : Wiśnie, mleczna czekolada.;whisky zachodnie;1;Moc:57,4%
WHISKY GLENDRONACH 21YO PARLIAMENT 0,7L 48%  SINGLEMALT;1299.00;https://alkoholeswiata24.pl/gfx/mini/1649405242.6051.jpg, https://alkoholeswiata24.pl/gfx/1649405242.6051.jpg;10;WHISKY GLENDRONACH 21YO PARLIAMENT 0,7L 48% SINGLEMALT Nazwa Glendronach pochodzi od kolonii wron,  parlamentu gawronów , które od stuleci gniazdują w pobliżu gorzelni. To bardzo ciekawa propozycja dla koneserów mocniejszych alkoholi.   głęboki bursztyn z połyskującym drzewem wiśniowym.  Delikatne połączenie dojrzałych jesiennych owoców - zwłaszcza jeżyny i czerwonej śliwki. Bogate nuty Oloroso Sherry i kandyzowanych pomarańczy. Przyprawione ciastka owsiane i prażony dąb o doskonałej wadze i harmonii.  wyczuwalne nuty przyjemnego sherry Oloroso i budyniu śliwkowego z sosem czekoladowym. Wspaniałe nuty przypraw - cynamon, ziele angielskie i gałka muszkatołowa. Pełnowartościowy z miękkimi taninami.   długotrwały z nutami lukrecji, czekolady, przypraw.;whisky zachodnie;1;Moc:48%
WHISKY GLENDRONACH 19YO SHERRY CASK NR4406  1995 0,7L 53,6%  SINGLEMALT;1690.00;https://alkoholeswiata24.pl/gfx/mini/1522069018.7223.jpg, https://alkoholeswiata24.pl/gfx/1522069018.7223.jpg;0;;whisky zachodnie;1;Moc:53,6%
WHISKY GLENDRONACH 18YO ALLADRDICE SHERRY CASK MATURED 46% 0,7L SINGLEMALT;999.01;https://alkoholeswiata24.pl/gfx/mini/1481281212.4218.jpg, https://alkoholeswiata24.pl/gfx/1481281212.4218.jpg;4;Po długiej nieobecności na półkach Destination Cellars z powodu zmiany dystrybutora, witamy z powrotem jeden z naszych ulubionych dramatów - Glendronach Allardice 18YO (nazwany na cześć założyciela destylarni) został w 100% dojrzały w najlepszych hiszpańskich beczkach po sherry Oloroso.  Ta wysublimowana, bogata, ciemna i uwodzicielska bomba sherry jest naprawdę niezapomniana.;whisky zachodnie;1;Moc:46%
WHISKY GLENDRONACH 15YO REVIVAL 0,7L 46% SINGLEMALT;369.90;https://alkoholeswiata24.pl/gfx/mini/1675068635.5425.jpg, https://alkoholeswiata24.pl/gfx/1675068635.5425.jpg;10;Alkohole online – whisky  Jest to pozycja obowiązkowa dla miłośników whisky.  Jest to intensywnie aromatyzowana whisky, mocno aromatyzowana, ponieważ Glendronach jest dobrze znany.  Dojrzewa przez 15 lat w beczkach po sherry Oloroso.   Na nosie ma imponującą koncentrację toffi melasowej i aromatów czekolady i pomarańczy.  Podniebienie jest dynamiczne z czekoladową pomarańczą, bułeczkami i kawą.;whisky zachodnie;1;Moc:46%
WHISKY GLENDRONACH 13YO CASK NR5480 2003 0,7L 54,6%  SINGLEMALT;650.01;https://alkoholeswiata24.pl/gfx/mini/1537797482.3706.jpg, https://alkoholeswiata24.pl/gfx/1537797482.3706.jpg;0;;whisky zachodnie;1;Moc:54,6%
WHISKY GLENDRONACH 12YO PEDRO XIMENEZ 0,7L 43%   SINGLEMALT;259.00;https://alkoholeswiata24.pl/gfx/mini/1649338475.8255.jpg, https://alkoholeswiata24.pl/gfx/1649338475.8255.jpg;2;WHISKY GLENDRONACH 12YO 0,7L 43% SINGLEMALT  to autentyczny single malt ze Speyside. Leżakowana przez co najmniej 12 lat w beczkach po Sherry Oloroso i Pedro Ximénez, ubrany w pyszne nuty subtelnie pikantnych suszonych owoców, delikatnie słodkich aromatów pieczonego jabłka, ciemnej czekolady, lukrecji i pigwy. Nie jest filtrowana na zimno, ani barwiona karmelem, dzięki czemu jej smak, kolor i aromat jest w pełni naturalny.;whisky zachodnie;1;Moc:43%
WHISKY GLENCADAM SINGLE MALT 32YO 1982 50,8L46%SZKOCJA;2950.00;https://alkoholeswiata24.pl/gfx/mini/1599122785.8578.jpg, https://alkoholeswiata24.pl/gfx/1599122785.8578.jpg;1;Rzadkie wydanie Glencadam Single Cask Malt Scotch Whisky. To złożony, obfity i mocny słód single cask, dojrzewający w pierwszorzędnych dębowych beczkach.  sierpniu 2014 Nos:  słodki i pachnący z nutą toffi i kandyzowanej skórki Smak:  Kremowy i miękki zrównoważony słodyczą toffi i kwiatowymi tonami Wykończenie:  Obfite i kremowe;whisky zachodnie;1;Moc: 0%
WHISKY GLENCADAM SINGLE MALT 15YO 0,7L 46% SZKOCJA;234.99;https://alkoholeswiata24.pl/gfx/mini/1599122259.6419.jpg, https://alkoholeswiata24.pl/gfx/1599122259.6419.jpg;0;Wielokrotnie nagradzana Glencadam Highland Single Scotch Malt Whisky Aged 15 Years jest doskonałym przykładem stuleci rzemiosła i tradycji. Słód „raczej dostojny” o przepięknie apetycznym, prawdziwym smaku.  Słone nuty z równowagą słodyczy. Delikatne, eleganckie i urocze  Soczysta świeżość ściętej trawy z apetyczną słodową nutą. Powściągliwa słodycz pieszczona przez miękki dąb  Średnia długość. Dąb równoważący słodsze właściwości z repryzą słodową;whisky zachodnie;1;Moc:46%
WHISKY GLENALLACHIE 8YO 0,7L 46% SINGLE MALT;279.90;https://alkoholeswiata24.pl/gfx/mini/1664796611.97.jpg, https://alkoholeswiata24.pl/gfx/1664796611.97.jpg;2;Whisky Glenallachie 8 YO 0,7l 46%;whisky zachodnie;1;Moc:46%
WHISKY GLENALLACHIE 30YO BATCH 3 0,7L 48,9% SINGLE MALT;4690.00;https://alkoholeswiata24.pl/gfx/mini/1696847266.2902.jpg, https://alkoholeswiata24.pl/gfx/1696847266.2902.jpg;1;Whisky Glenallachie 30 YO Batch 3 . Wydana w 2023 roku w limitowanej ilości 2400 butelek na cały świat. To   z podstawowej oferty niezależnej firmy Glenallachie. Produkowana pod czujnym okiem Master Blendera Billy'ego Walkera, który w zeszłym roku świętował pięćdziesięciolecie swojej pracy w branży alkoholowej.   łączy trzy wyjątkowe beczki wyselekcjonowane przez Walkera, po sherry Pedro Ximenez, Oloroso oraz w nowe beczki z dębu amerykańskiego.   łączącym nuty bogatego espresso, orzechów laskowych, czekolady, imbiru i duszonych śliwek. Zabutelkowana z mocą beczki 48,9% ABV, niefiltrowana na zimno oraz bez sztucznych barwników. Do butelki zostało dołączone luksusowe pudełko w kolorze królewskiego błękitu z zamszową wyściółką i złotymi detalami.   odpowiednia dla kolekcjonerów lub na wyjątkowy prezent. Doskonale sprawdzi się na 30 urodziny, narodziny dziecka czy 30stą rocznicę ślubu. Idealna również na świętowanie sukcesu w firmie.  Whisky Glenallachie 30 YO Batch 3 - noty degustacyjne : Prażone migdały, miód, owoce sadu, skóra, toffi. W tle skórka pomarańczowa i ciemna czekolada.  : Niuanse moszczu winogronowego, orzechy laskowe, miód. Następnie owoce cytrusowe, toffi i akcent imbiru. : Rozgrzewający i utrzymujący się. Nuty cynamonu i kawy.;whisky zachodnie;1;Moc:48,9%
WHISKY GLENALLACHIE 2012 CUVEE WINE CASK FINISH 0,7L 48%;449.00;https://alkoholeswiata24.pl/gfx/mini/1675694018.7844.jpg, https://alkoholeswiata24.pl/gfx/1675694018.7844.jpg;3;Whisky Glenallachie 2012 Cuvee Wine Cask Finish 0,7l 48% Szkocka whisky z limitowanej edycji powstała w wyniku pasji i zaangażowania doświadczonego  Billy’ego Walkera. Glenallachie whisky została wydestylowana w 2012 roku i przez ponad 8 lat dojrzewała w beczkach po bourbonie. Następnie na kolejne 20 miesięcy trafiła do beczek po czterech rodzajach win: z Langwedocji, po Recioto della Valpolicella oraz po dwóch winach klasy Premier Cru z Bordeaux. Efektem jest whisky pełna owocowych aromatów o gładkim, harmonijnym charakterze. Szkocka whisky Glenallachie została zabutelkowana bez filtracji na zimno z mocą 48%, nie karmelizowana.  Jakie ma cechy i jak smakuje Glenallachie 2012 Cuvee Wine Cask Finish? : Świeży i aksamitny. Kwiat pomarańczy, świeżo palona kawa, kandyzowana wiśnia Maraschino, orzechy laskowe, lawenda i nuta cynamonu.  : Gorzka czekolada, czerwone porzeczki, palone ziarna kawy, migdały, jeżyny, skórka pomarańczowa, akcent lukrecji i imbiru. : Długi i rozgrzewający, nuta anyżu i lukrecji.;whisky zachodnie;1;Moc:48%
WHISKY GLENDRONACH 8YO THE HIELAN 46% 0,7L;194.99;https://alkoholeswiata24.pl/gfx/mini/1614977398.8005.jpg, https://alkoholeswiata24.pl/gfx/1614977398.8005.jpg;0;Glendronach 8 YO „The Hielan” został nazwany na cześć jego szkockiej ojczyzny, Highlands.  To może być ostatnia butelka stworzona przez destylarnię, ale Glendron jest wrażliwy na tradycję.  Ta 8-letnia whisky single malt ma przywoływać koneserom Szkocję swoją prezentacją i smakiem - mocnym, złożonym i wielowymiarowym.  Ta whisky Highland została zabutelkowana z zawartością alkoholu do 46%. a  jednak emanuje niesamowitą słodyczą.;whisky zachodnie;1;Moc:46%
WHISKY GLENFARCLAS 10YO SINGLE MALT 0,7L 40% SCOTCH;199.99;https://alkoholeswiata24.pl/gfx/mini/1539685963.4294.jpg, https://alkoholeswiata24.pl/gfx/1539685963.4294.jpg;6;;whisky zachodnie;1;Moc:40%
WHISKY GLENFARCLAS 12YO CASK STRENGTH BATCH 2 ZIMORODEK 0,7L 59,6% SCOTCH;430.00;https://alkoholeswiata24.pl/gfx/mini/1678707945.0669.jpg, https://alkoholeswiata24.pl/gfx/1678707945.0669.jpg;0;Whisky Glenfarclas 12 YO Cask Strength Batch 2 0,7l 59,6% - zimorodek;whisky zachodnie;1;Moc:59,6%
WHISKY GLENFARCLAS 12YO SINGLE MALT 0,7L 43% SCOTCH;238.01;https://alkoholeswiata24.pl/gfx/mini/1523956295.0362.jpg, https://alkoholeswiata24.pl/gfx/1523956295.0362.jpg;3;;whisky zachodnie;1;Moc:43%
WHISKY GLENFARCLAS 10YO CASK STRENGTH 0,7L 60,5% DUDEK SCOTCH;399.00;https://alkoholeswiata24.pl/gfx/mini/1664891116.3745.jpg, https://alkoholeswiata24.pl/gfx/1664891116.3745.jpg;0;Whisky Glenfarclas Cask Strength 10 YO 0,7l 60,5%;whisky zachodnie;1;Moc:60,5%
WHISKY GLENDRONACH VINTAGE 1993 25YO 48,2 % 0,7L;1399.00;https://alkoholeswiata24.pl/gfx/mini/1589268539.9035.jpg, https://alkoholeswiata24.pl/gfx/1589268539.9035.jpg;0;;whisky zachodnie;1;Moc: 0%
WHISKY GLENDRONACH PEATED 46% 0,7L;269.99;https://alkoholeswiata24.pl/gfx/mini/1586515983.5177.jpg, https://alkoholeswiata24.pl/gfx/1586515983.5177.jpg;0;Glendronach Peated to bardzo nietypowa whisky, ponieważ destylarnia tradycyjnie produkuje wyłącznie słód niepowtarzalny.  Nie jest to jednak pierwszy torfowany Glendronach w całej historii destylarni.  W początkach destylarni słód był zawsze suszony torfem.  To ekspresja początkowo dojrzewa w tradycyjnych beczkach po burbonie, a następnie kończy w beczkach po sherry Oloroso i Pedro Ximénez.;whisky zachodnie;1;Moc:46%
WHISKY GLENDRONACH GRANDEUR 27YO 50,1 % 0,7L;2779.90;https://alkoholeswiata24.pl/gfx/mini/1585815026.1769.jpg, https://alkoholeswiata24.pl/gfx/1585815026.1769.jpg;0;Dziesiąte wydanie z serii GlenDronach Grandeur, stworzone przez Master Distiller, Rachel Barrie, z jednych z najstarszych i najbardziej wyjątkowych beczek po sherry Pedro Ximénez i Oloroso w gorzelni GlenDronach.  Ten 27-letni słód góralski został butelkowany do 50,1% obj. I zgodnie z wcześniejszymi wersjami Grandeur, każda butelka została ręcznie ponumerowana, woskowana i zapakowana do  wyjątkowo stylowego pudełka.   dojrzałe śliwki i świeżo spękane czarne orzechy włoskie, z aromatami dojrzałych jeżyn i dżemu jabłkowego - za nimi stara skóra, trufle i cygara - przede wszystkim szlachetna słodycz sherry  teraz wyraźnie wpływ sherry, dojrzałe wiśnie morello w ciemnej czekoladzie, z jeżynowym wykończeniem: długie, bogate wykończenie - czarna trufla i imbirowy chleb, w połączeniu z suszonymi śliwkami i olejem z orzechów włoskich;whisky zachodnie;1;Moc: 0%
WHISKY GLENDRONACH CASK STRENGTH BATCH 7 0,7L 57,9%;359.98;https://alkoholeswiata24.pl/gfx/mini/1628661100.7563.jpg, https://alkoholeswiata24.pl/gfx/1628661100.7563.jpg;2;;whisky zachodnie;1;Moc:57,9%
