name;price;image_url;quantity;description;category;tax;power
WHISKEY NATTERJACK CASK STRENGTH 63% 0,7L IRLANDIA;316.99;https://alkoholeswiata24.pl/gfx/mini/1680255579.7591.jpg, https://alkoholeswiata24.pl/gfx/1680255579.7591.jpg;0;Whiskey Natterjack Cask Strength - whiskey irlandzka   wydana w 2022 roku w jedynie 300 egzemplarzach. Netterjack to whiskey dla ludzi szukających czegoś innego niż tradycyjne szkockie czy irlandzkie trunki. To niezwykłe kraftowe połączenie  , typowymi dla  . Natterjack powstaje z mieszanki kukurydzy (80%) i słodu jęczmiennego (20%). Destylat starzony jest najpierw w beczkach po bourbonie, a następnie finiszowane w beczkach typu virgin oak.  Nazwa Natterjack wzięła się od irlandzkiej  , która zamiast skakać chodzi i przez to obiera swoje własne drogi. Taka właśnie jest whisky Natterjack. Nietypowa i wychodząca poza schematy. To  , odpowiednia dla ludzi poszukujących niekonwencjonalnych rozwiązań. Zabutelkowana z mocą beczki 63% abv. Natterjack Cask Strength whiskey : Orzeźwiający aromat świeżych pomarańczy, wanilia.  : Gładki i mimo dużej mocy, łagodny. Pomarańcza, słód, goździki, toffi i dąb. : Aksamitny i miodowy.;whisky zachodnie;1;Moc:63%
WHISKEY TULLAMORE DEW 0,7L ZESTAW 2 SZKLANKI;102.00;https://alkoholeswiata24.pl/gfx/mini/1669807511.478.jpg, https://alkoholeswiata24.pl/gfx/1669807511.478.jpg;5;Whiskey Tullamore DEW 0,7l w zestawie z dwoma szklankami;whisky zachodnie;1;Moc: 0%
WHISKY BABA YAGA 1L 40%;129.99;https://alkoholeswiata24.pl/gfx/mini/1669191852.8213.jpg, https://alkoholeswiata24.pl/gfx/1669191852.8213.jpg;0;;whisky zachodnie;1;Moc:40%
WHISKEY JACK DANIELS GENTLEMAN JACK 0,7L 40%;129.99;https://alkoholeswiata24.pl/gfx/mini/1679042586.211.jpg, https://alkoholeswiata24.pl/gfx/1679042586.211.jpg;10;Whiskey Burbon Jack Daniels Gentleman Jack 0,7l 40%  pojawiła się na rynku w 1988 roku i jest drugą whisky po Jack Daniel's Old No. 7, która została włączona do stałej oferty marki. Jego twórcą jest Lincoln Henderson, wieloletni mistrz destylacji koncernu Brown - Forman, który całe swoje życie poświęcił pasji tworzenia tego niezwykłego, złotego trunku.  Co wyróżnia Whisky Burbon Jack Daniels Gentleman Jack? Proces produkcji Jack'a Daniels'a rozpoczyna się od podwójnej filtracji alkoholu przez 3-metrową warstwę klonowego węgla drzewnego. Gentelman Jack od standardowego Jack'a Daniels'a różni się tym, że proces ten zastosowany jest zarówno przed jak i po starzeniu trunku, bezpośrednio przed jej zabutelkowaniem. Po filtracji następuje dojrzewanie Gentelmenta Jack'a w ręcznie robionych dębowych beczkach co wpłynęło na wyjątkowy profil smakowy trunku. Doskonały smak wzbogacony wspaniałymi akcentami wanilii, toffi i klonowanego dymu jest doceniany przez koneserów whisky na całym świecie.  Jak smakuje whiskey Jack Daniel’s Gentleman Jack? : Kremowy i jedwabisty, nuty wanilii i toffi. Banany, cynamon z akcentami dymu i węgla. : Łagodny i miękki. Utrzymujące się nuty wanilii i karmelu, akcenty owoców ze szczyptą cynamonu i pieprzu.  : Średnio długi, delikatnie słodki z nutami węgla drzewnego.  Whiskey Burbon Jack Daniels Gentleman Jack 0,7l 40% -  , zamów online i przekonaj się o jej niezwykłym smaku!;whisky zachodnie;1;Moc:40%
WHISKEY TULLAMORE DEW 0,7L 40% IRLANDIA;88.90;https://alkoholeswiata24.pl/gfx/mini/1481207707.9085.jpg, https://alkoholeswiata24.pl/gfx/1481207707.9085.jpg;9;WHISKEY TULLAMORE 0,7L 40% IRLANDIA Lekka mieszanka zdominowana przez szarość, nie rzucająca się w oczy. Trochę słodkiej wanilii i odrobina przypraw.  jasny, złoty.  Łagodna mieszanka aromatów pikantnych, cytrynowych i słodowych. Delikatny, delikatny, dymny. Aksamitne, miękkie, okrągłe w ciele.  rozgrzewający i przypominający słodkie przyprawy, przyjemny słodowy. Bardzo dojrzałe, zrównoważone, złożone, lekkie nuty miodu. W posmaku powolny, miękki i przyjemny, długi ze złożonym aromatem.  miękkie,aksamitne, okrągłe w ciele.;whisky zachodnie;1;Moc:40%
WHISKY BOURBON BULLEIT 0,7L 45% USA;117.00;https://alkoholeswiata24.pl/gfx/mini/1508850351.6534.jpg, https://alkoholeswiata24.pl/gfx/1508850351.6534.jpg;2;Whisky online;whisky zachodnie;1;Moc:45%
WHISKY BOURBON JIM BEAM BLACK 0,7L 43%;101.00;https://alkoholeswiata24.pl/gfx/mini/1526472180.5463.jpg, https://alkoholeswiata24.pl/gfx/1526472180.5463.jpg;1;Alkohole świata online – whisky  Jim Beam – whiskey typu bourbon destylowana w Clermont w stanie Kentucky. Powstaje od 1795 roku Jim Beam Black to bourbon 6-letni, starzony w beczkach trzykrotnie dłużej, aniżeli przewiduje to amerykańskie prawo (stąd też triple aged). Jest to najbardziej znana, obok Jack'a Daniels'a marka bourbona.  Karmel, skórka pomarańczy i wanilia.  Gładki. Toffi, nuty miodowe, dlaej cytrusy.  Średnio długi. Cytrusy i dębina.;whisky zachodnie;1;Moc:43%
WHISKEY THE IRISHMAN SINGLE MALT 0,7L 40% IRLANDIA;229.00;https://alkoholeswiata24.pl/gfx/mini/1668590021.3641.jpg, https://alkoholeswiata24.pl/gfx/1668590021.3641.jpg;3;;whisky zachodnie;1;Moc:40%
WHISKY BOURBON JIM BEAM 0,7L 40% + SZKL. W PUSZCE USA;109.00;https://alkoholeswiata24.pl/gfx/mini/1614168349.8015.jpg, https://alkoholeswiata24.pl/gfx/1614168349.8015.jpg;0;prawdziwej pasji,  220 lat doświadczenia trafia do każdej butelki w raz z żytem ze słodu jęczmiennego i oczywiście prawdziwą pasją.  Czy nie warto wiedzieć, że niektóre rzeczy nigdy nie wychodzą z mody?  Wypij łyk, a dowiesz się, co mamy na myśli.  40% potwierdza smak, który przeszedł do historii. Jim Beam to  najlepiej sprzedający się bourbon na świecie, z którego korzystają ludzie na całym świecie. E legancki, g ładki wyr afinowany.  To właśnie 4 lata starzenia się w nowych zwęglonych dębowych beczkach robią naszemu bourbonowi.  Każda kropla jest warta wysiłku.  W nosie czuć  dębowe waniliowe korzenne tło. W smaku  średnio wytrawne nuty karmelu i wanilii.;whisky zachodnie;1;Moc:40%
WHISKEY TEELING WONDERS OF WOOD SINGLE POT STILL VIRGIN PORTUGUESE OAK 0,7L 50%;389.00;https://alkoholeswiata24.pl/gfx/mini/1683619155.2656.jpg, https://alkoholeswiata24.pl/gfx/1683619155.2656.jpg;3;Whiskey Teeling Wonders Of Wood Single Pot Still Virgin Portuguese Oak Produkowana ze słodowanego (50%) i świeżego jęczmienia (50%), destylowana potrójnie. Dojrzewała w nowych beczkach z dębu portugalskiego. Zabutelkowana z mocą 50% abv bez filtracji na zimno. To świetna propozycja dla koneserów irlandzkich whiskey.  Whiskey Teeling Wonders Of Wood Virgin Portuguese Oak - noty degustacyjne : Owoce cytrusowe, skóra, cynamon  : Wanilia, tytoń, słód jęczmienny. : Długi i rozgrzewający z nutą goździków.  Zamów online drugą whiskey z serii Wonders Of Wood lub zapoznaj się z innymi  .;whisky zachodnie;1;Moc:50%
WHISKY BOURBON JACK DANIEL'S FAMILY BOX  3x0.7L;599.99;https://alkoholeswiata24.pl/gfx/mini/1481207715.1926.jpg, https://alkoholeswiata24.pl/gfx/1481207715.1926.jpg;0;Ten wyjątkowy zestaw umieszczony w znakomicie prezentującej się drewnianej skrzynce zawiera trzy produkty: Old No.7, Gentleman Jack oraz Single Barrel. Każda z butelek o pojemności 0,7l pozwoli dłużej kontemplować bogaty smak i docenić wartość naturalnego procesu dojrzewania. Zestaw umieszczony jest w drewnianej skrzyni nie bez powodu. Otóż drewno obecne jest na każdym etapie wytwarzania whiskey Jack Daniel’s. Każda z tych whiskey dojrzewa w nowych, dębowych beczkach, które są wytwarzane wyłącznie z wyselekcjonowanych gatunków drewna.;whisky zachodnie;1;Moc: 0%
WHISKEY TULLAMORE DEW XO RUM CASK FINISH 0,7L 43% IRLANDIA;104.89;https://alkoholeswiata24.pl/gfx/mini/1537262341.0093.jpg, https://alkoholeswiata24.pl/gfx/1537262341.0093.jpg;4;WHISKY TULLAMORE DEW XO RUM CASK FINISH - irlandzka;whisky zachodnie;1;Moc:43%
WHISKY BOURBON EZRA BROOKS BLACK LABEL 0,7L 40%;109.00;https://alkoholeswiata24.pl/gfx/mini/1677839513.3148.jpg, https://alkoholeswiata24.pl/gfx/1677839513.3148.jpg;4;Whiskey Bourbon Ezra Brooks Black Label- Kentucky Straight Bourbon Whiskey   to amerykańska Bourbon Whiskey produkowana w destylarni Medley od lat 50 ubiegłego wieku w stanie Kentucky. W 1966 roku marka została uznana przez amerykański rząd jako „Kentucky’s finest Little distillery” co w tłumaczeniu oznacza  Podczas produkcji destylat jest filtrowany przez węgiel drzewny, co nadaje trunkowi delikatny i łagodny charakter. . Ze względu na przystępną cenę będzie odpowiednim wyborem na imprezy jak i do wieczornego relaksu.  Ezra Brooks Black Label Whiskey Burbon  : Mocne owocowe aromaty z przewagą jabłka i cytrusów. Całość uzupełniona akcentem przypraw.  : Dominujące nuty wanilii i toffi z mieszanką owoców sadu.  : Średnio długi z akcentem czekolady.;whisky zachodnie;1;Moc:40%
WHISKEY WATERFORD THE CUVEE 0,7L 50% IRELAND;309.00;https://alkoholeswiata24.pl/gfx/mini/1697462098.6633.jpg, https://alkoholeswiata24.pl/gfx/1697462098.6633.jpg;2;"Whiskey Waterford The Cuvee  należąca do serii ""Single Farm Origin"". To niezwykły mariaż 25   destylowanych z lokalnie uprawianego jęczmienia przez irlandzkich farmerów. To najbardziej unikalne wydanie destylarni inspirowane wysokiej klasy francuskimi winami Bordeaux. Whiskey Waterford The Cuvee dojrzewała w beczkach z dębu amerykańskiego, beczce virgin oak (pierwszego napełnienia), z dębu francuskiego oraz po winie Vin doux Naturel. Zabutelkowana z mocą 50% ABV bez filtracji na zimno, niekoloryzowana.  Whiskey Waterford The Cuvee - jak smakuje? : Czerwone jabłka, nuty ziemiste, lawenda, ciasteczka korzenne, pomarańcze, banan, nuta mięty, ciasto kawowe.  : Lekko oleisty, słodki. Goździki, biały pieprz, grejpfrut, skórka cytryny, gorzka czekolada, wiśnie, suszone zioła, anyż, zielone oliwki, marmolada. : Pieprzny z nutą pikantną.";whisky zachodnie;1;Moc:50%
WHISKY BALBLAIR 12YO 0,7L 46% SCOTCH KARTON;214.99;https://alkoholeswiata24.pl/gfx/mini/1570785532.2326.jpg, https://alkoholeswiata24.pl/gfx/1570785532.2326.jpg;6;;whisky zachodnie;1;Moc:46%
WHISKY BOURBON JIM BEAM DEVIL'S CUT 0,7L 45% USA + SZKLANKA;89.99;https://alkoholeswiata24.pl/gfx/mini/1570710911.6977.jpg, https://alkoholeswiata24.pl/gfx/1570710911.6977.jpg;0;im Beam Devil's Cut to whisky mocnym smaku z głęboką barwą, aromatem i charakterem.  Niezwykle drzewny, świeżo ścięty dąb i cała masa wanilii i przypraw drzewnych. Podniebienie:   amerykańskiego dębu pozostaje mocna, łączy się z nią bogata drzewność.  Finisz:  jest dość długi ze szczyptą przyprawy rozsypanej na szczycie tego trwałego smaku wanilii.;whisky zachodnie;1;Moc:45%
WHISKEY WATERFORD BALLYMORGAN EDITION 1.1 0,7L 50% IRELAND;400.00;https://alkoholeswiata24.pl/gfx/mini/1615494265.9161.jpg, https://alkoholeswiata24.pl/gfx/1615494265.9161.jpg;1;;whisky zachodnie;1;Moc:50%
WHISKEY WATERFORD BALLYKILVCAVAN EDITION 1.2 0,7L 50% IRELAND;400.00;https://alkoholeswiata24.pl/gfx/mini/1615494355.6063.jpg, https://alkoholeswiata24.pl/gfx/1615494355.6063.jpg;1;;whisky zachodnie;1;Moc:50%
WHISKY BALLANTINE'S 12 YO 0,7L 40%;104.89;https://alkoholeswiata24.pl/gfx/mini/1599038950.5134.jpg, https://alkoholeswiata24.pl/gfx/1599038950.5134.jpg;10;WHISKY BALLANTINE'S 12 YO 0,7L 40% - szkocka -letnia Ballantine's  zdobyła wiele międzynarodowych nagród i ustanowiła złoty standard dla szkockiej whisky premium.  Ballantine's 12yo to bogata, gładka i wyrafinowana whisky mieszana ze specjalnie wyselekcjonowanych whisky single malt i zbożowych.  12-letni Ballantine's, wcześniej nazywany Złotą Pieczęcią, jest zdobywcą Srebrnego Medalu ISC w 2005 roku. Zawartość alkoholu 40%. Jeśli ten produkt nie jest dostępny;whisky zachodnie;1;Moc:40%
WHISKEY VELVET CAP TRIPLE CASK 46% 0,7L;189.00;https://alkoholeswiata24.pl/gfx/mini/1682507176.5403.jpg, https://alkoholeswiata24.pl/gfx/1682507176.5403.jpg;3;Whiskey Velvet Cup Triple Cask 0,7l 46% - whiskey irlandzka . To wspaniała mieszanka whiskey słodowej i zbożowej, starzona w beczkach po porto, bourbonie i piwie stout.  . Trunek zabutelkowany został z mocą 46% abv. Do butelki dołączona przykuwająca wzrok biała puszka z czerwonymi kropkami.  Velvet Cup Triple Cask Irish Whiskey - noty degustacyjne : Kandyzowany banan, miód, ciemne owoce pestkowe, migdały.  : Wanilia, śliwka, agawa.  : Średnio długi i słodki.;whisky zachodnie;1;Moc:46%
WHISKY BALBLAIR 18YO 0,7L 46% SCOTCH KARTON;659.00;https://alkoholeswiata24.pl/gfx/mini/1685622521.0165.jpg, https://alkoholeswiata24.pl/gfx/1685622521.0165.jpg;6;Whisky Balblair 18 YO - szkocka whisky online  produkowana jest w jednej z najstarszych destylarni w Szkocji- Balblair. Gorzelnia została założona w 1790 roku w regionie Highlands. Balblair 18 YO dojrzewała w beczkach po bourbonie i finiszowana była w beczkach pierwszego napełnienia po sherry. Butelkowana z mocą 46% abv bez koloryzacji i bez filtracji na zimno.   W smaku i aromacie bardzo przyjemna, przypadnie do gustu zarówno zaawansowanym koneserom szkockich, jak i początkującym.  Balblair 18 years old - noty degustacyjne : Jabłko oblane toffi, gruszki w rozgrzewających przyprawach, akcent skóry. : Słodkie, dojrzałe morele, suszone owoce, toffi, wanilia, dąb. : Długi, rozgrzewające, korzenne przyprawy, rodzynki, karmel i nuta dębu.;whisky zachodnie;1;Moc:46%
WHISKY BOURBON JIM BEAM BLACK 0,7L 43% +2SZKL.;97.90;https://alkoholeswiata24.pl/gfx/mini/1645179122.5604.jpg, https://alkoholeswiata24.pl/gfx/1645179122.5604.jpg;0;Jim Beam Black to bourbon 6-letni, starzony w beczkach trzykrotnie dłużej, aniżeli przewiduje to amerykańskie prawo (stąd też triple aged). Jest to najbardziej znana, obok Jack'a Daniels'a marka bourbona. Klasyk w opakowaniu z dwoma eleganckimi szklankami, idealna propozycja na prezent ale i do użytku domowego.   Karmel, skórka pomarańczy i wanilia.  Gładki. Toffi, nuty miodowe, dlaej cytrusy.  Średnio długi. Cytrusy i dębina.;whisky zachodnie;1;Moc:43%
WHISKY BALLANTINE'S 15 YO MILTONDUFF SINGLE MALT 0,7L 40% PUSZKA;239.00;https://alkoholeswiata24.pl/gfx/mini/1517776488.7596.jpg, https://alkoholeswiata24.pl/gfx/1517776488.7596.jpg;2;WHISKY BALLANTINE'S 15YO MILTONDUFF SINGLE MALT 0,7L 40% PUSZKA;whisky zachodnie;1;Moc:40%
WHISKY BOURBON EZRA BROOKS 7YO 0,75L 58,5%;264.91;https://alkoholeswiata24.pl/gfx/mini/1611311950.2179.jpg, https://alkoholeswiata24.pl/gfx/1611311950.2179.jpg;0;;whisky zachodnie;1;Moc:58,5%
WHISKY BALLANTINE'S 15 YO GLENTAUCHER 0,7L 40%;259.00;https://alkoholeswiata24.pl/gfx/mini/1540888417.8232.jpg, https://alkoholeswiata24.pl/gfx/1540888417.8232.jpg;2;;whisky zachodnie;1;Moc:40%
WHISKY BOURBON BULLEIT RYE 0,7L 45% USA;128.01;https://alkoholeswiata24.pl/gfx/mini/1557308620.6372.jpg, https://alkoholeswiata24.pl/gfx/1557308620.6372.jpg;2;bourbon charakteryzujący się rdzawym kolorem, z bogatą gamą aromatów. Smak jest wyjątkowo gładki, z nutą wanilii, miodu i przypraw.  Wyprodukowany jest w 95% z żyta i 5% ze słodu jęczmiennego. To zdobywca wielu prestiżowych nagród.;whisky zachodnie;1;Moc:45%
WHISKY BALBLAIR 15YO 0,7L 46% SCOTCH KARTON;489.90;https://alkoholeswiata24.pl/gfx/mini/1574934554.2296.jpg, https://alkoholeswiata24.pl/gfx/1574934554.2296.jpg;2;Tropikalna i dojrzała, z teksturą rozpuszczonej czekolady i jednym z najlepszych finishów, jakie może przynieść pojedynczy słód. Ten oszałamiający Balblair zdecydowanie wymaga spokojnego podziwu. Smaki są pełne i aksamitne, ale też rozwinięte i świeże. Wygładzona przez czas, ale z bijącym sercem regionu Highlands.  Początkowo w beczkach po burbonie z amerykańskiego dębu, a następnie w bogatych w aromaty beczkach pierwszego napełnienia z hiszpańskiego dębu. Kolor: Jasny bursztyn Zapach: Miodu kwiatowego i pikantnego piernika, a następnie soczystych śliwek i świeżej skórki z cytryny Smak: Aksamitna konsystencja, eksplodująca ciemną czekoladą, owocami tropikalnymi i przyprawami Finish: Długi i łagodny z nutami kremowej wanilii i cytrusów;whisky zachodnie;1;Moc:46%
WHISKY BOURBON BULLEIT 10YO 0,7L 45,6% USA;169.90;https://alkoholeswiata24.pl/gfx/mini/1556011776.1325.jpg, https://alkoholeswiata24.pl/gfx/1556011776.1325.jpg;0;;whisky zachodnie;1;Moc:45,6%
WHISKY BALLANTINE'S 15 YO GLENBURGIE  0,7L 40% PUSZKA;259.00;https://alkoholeswiata24.pl/gfx/mini/1538569520.814.jpg, https://alkoholeswiata24.pl/gfx/1538569520.814.jpg;1;Ballantine's The Glenburgie 15YO wraz z Ballantine's The Miltonduff 15YO to jedne z pierwszych whisky typu single malt spod znaku Ballantine's - marki, która do tej pory była rozpoznawalna jako czołowy producent w kategorii whisky typu blended.;whisky zachodnie;1;Moc:40%
WHISKEY WEST CORK GLENGARRIFF PEAT CHARRED CASK 0,7L 43% IRLANDIA;174.91;https://alkoholeswiata24.pl/gfx/mini/1664795572.1964.jpg, https://alkoholeswiata24.pl/gfx/1664795572.1964.jpg;1;Whiskey West Cork Glengarriff Peat Charred Cask 0,7l 43% Irlandia;whisky zachodnie;1;Moc:43%
WHISKY BALBLAIR 12YO GORDON & MACPHAIL DISCOVERY 0,7L 43% SCOTCH TUBA;239.90;https://alkoholeswiata24.pl/gfx/mini/1544693741.6341.jpg, https://alkoholeswiata24.pl/gfx/1544693741.6341.jpg;0;WHISKY GORDON&MACPHAIL DISCOVERY BALBLAIR 12YO 0,7L 43% SCOTCH TUBA;whisky zachodnie;1;Moc:43%
WHISKEY WEST CORK CASK STRENGTH 0,7L 62% IRLANDIA;263.99;https://alkoholeswiata24.pl/gfx/mini/1667401021.0967.jpg, https://alkoholeswiata24.pl/gfx/1667401021.0967.jpg;10;Whiskey irlandzka West Cork Cask Strenght 0,7l 62%;whisky zachodnie;1;Moc:62%
WHISKEY WEST CORK BLENDED IPA CASK 0,7L 40% IRLANDIA;144.50;https://alkoholeswiata24.pl/gfx/mini/1664795275.1399.jpg, https://alkoholeswiata24.pl/gfx/1664795275.1399.jpg;0;Whiskey West Cork Blended IPA Cask 0,7l 40% Irlandia;whisky zachodnie;1;Moc:40%
WHISKY BOURBON JIM BEAM RED STAG 0,7L 32,5%;86.51;https://alkoholeswiata24.pl/gfx/mini/1538571662.6706.jpg, https://alkoholeswiata24.pl/gfx/1538571662.6706.jpg;1;Alkohole świata online – whisky  Red Stag jest najnowszym dziełem destylarni Jim Beam. Prezentowana wersja wytwarzana jest na bazie podstawowego 4- letniego Jim Beam, do którego stopniowo dodawany jest naturalny aromat czarnej wiśni. Uzyskany trunek ma wyjątkowo łagodny i niespotykany smak. Owocowa nuta pojawiająca się dzięki wprowadzeniu do produktu czarnej wiśni nie przytłacza typowego dla bourbonu aromatu. Umiarkowanie słodki smak przeplata się z łagodnymi elementami dębu i nutami czarnej wiśni. Finisz niesłychanie miękki, głęboki, pełny prawdziwego ciepła tradycyjnego Jim Beam’a.;whisky zachodnie;1;Moc:32,5%
WHISKEY WEST CORK BLACK CASK 0,7L 40% IRLANDIA KARTON;159.90;https://alkoholeswiata24.pl/gfx/mini/1664792789.7055.jpg, https://alkoholeswiata24.pl/gfx/1664792789.7055.jpg;0;Whiskey West Cork Black Cask 0,7l 40% Irlandia;whisky zachodnie;1;Moc:40%
WHISKY BOURBON JIM BEAM SINGLE BARREL 47,5 % 0,7L;195.99;https://alkoholeswiata24.pl/gfx/mini/1588065862.4609.jpg, https://alkoholeswiata24.pl/gfx/1588065862.4609.jpg;0;Jim Beam Single Barrel jest tak wyjątkowy, jak beczka, w której leżakuje. Jest to pierwsza w historii prosta bourbonowa whisky Kentucky butelkowana z Single Charred Oak Barrel. Ma cudownie bogaty, dębowy waniliowy smak i lekką pikantność - ale żadne dwie partie nigdy nie będą smakować tak samo, ponieważ każda dojrzewa trochę inaczej.;whisky zachodnie;1;Moc: 0%
WHISKY BALLANTINE'S 7 YO 0,7L 40%;84.00;https://alkoholeswiata24.pl/gfx/mini/1600177354.5784.jpg, https://alkoholeswiata24.pl/gfx/1600177354.5784.jpg;5;Szkocka whiskey Ballantine's 0,7l 40%;whisky zachodnie;1;Moc:40%
WHISKEY WEST CORK 7YO M&P SINGLE CASK 606  0,7L 54,7% IRLANDIA;234.91;https://alkoholeswiata24.pl/gfx/mini/1696510308.2773.jpg, https://alkoholeswiata24.pl/gfx/1696510308.2773.jpg;5;Whiskey West Cork 7 YO M&P Single Cask 606 Irlandzka whisky West Cork 7 YO wyprodukowana dla M&P w wersji Single Cask. To najnowsza edycja West Cork 606. Przez pierwsze 4 lata leżakowała w beczce po sherry Oloroso, a następne 3 lata dojrzewała w beczce pierwszego napełnienia po bourbonie. Zabutelkowana z mocą 54,7% ABV.  Whiskey West Cork 7 YO M&P Single Cask 606 : Jagody, maliny, wanilia.  : Słód, cytrusy, delikatne przyprawy. : Przyjemny, długi i oleisty.;whisky zachodnie;1;Moc:54,7%
WHISKY BOURBON JIM BEAM DOUBLE OAK 0,7L 43%+2SZKL.;94.99;https://alkoholeswiata24.pl/gfx/mini/1546853700.2037.jpg, https://alkoholeswiata24.pl/gfx/1546853700.2037.jpg;0;Jim Beam Double Oak jest wykonany ze zwęglonego dębu.  Jednak w przeciwieństwie do innych, swój bogaty smak zawdzięcza dojrzewaniu w osobnej, świeżo zwęglonej beczce.  Ten wyjątkowy proces nadaje Jim Beam Double Oak intensywny i bardziej wyrazisty smak z niesamowitą gładkością, jakiej nie ma żaden inny bourbon. Aromat:  mocny wanilia, stary dąb, mleczna czekolada i odrobina kardamonu. Podniebienie: na  początku delikatnie pieprzowe / dębowe. Wkrótce fale lodów waniliowych przywracają równowagę podniebieniu. Kilka akcentów owocowego słodu. Wykończenie:  Opalony dąb długo utrzymuje się na finiszu.;whisky zachodnie;1;Moc:43%
WHISKEY WEST CORK SINGLE CASK 2450 M&P 0,7L 56,5% IRLANDIA;249.99;https://alkoholeswiata24.pl/gfx/mini/1617296257.0914.jpg, https://alkoholeswiata24.pl/gfx/1617296257.0914.jpg;1;;whisky zachodnie;1;Moc:56,5%
WHISKY BALLANTINE'S 30 YO 0,7L 43% SKRZYNKA;1399.00;https://alkoholeswiata24.pl/gfx/mini/1694612509.003.jpg, https://alkoholeswiata24.pl/gfx/1694612509.003.jpg;1;;whisky zachodnie;1;Moc:43%
WHISKY BOURBON JIM BEAM PEACH 32,5% 0,7L;83.00;https://alkoholeswiata24.pl/gfx/mini/1671051540.6784.jpg, https://alkoholeswiata24.pl/gfx/1671051540.6784.jpg;3;Whisky Bourbon Jim Beam Peach 0,7l 32,5%;whisky zachodnie;1;Moc:32,5%
WHISKY BALLANTINE'S 21 YO 0,7L 43%;384.01;https://alkoholeswiata24.pl/gfx/mini/1526464459.4381.jpg, https://alkoholeswiata24.pl/gfx/1526464459.4381.jpg;1;WHISKY BALLANTINE'S 21YO 43% 0,7l - szkocka whiskey łyszczący złoty kolor, kwiatowy nos i aromatyczne podniebienie nadają tej whisky zachwycającej złożoności.  Aromat:   żywy, ale wyrafinowany, nuty owoców pestkowych, marmolady i lukrecji. Przejawia się trochę aromatycznych przypraw i dym drzewny.  Podniebienie:   słodsze i bardziej intensywne, tutaj pojawia się miód wraz z obfitością jabłka, soczystej pomarańczy i bogatych owoców żywopłotu. Finisz:   suszone owoce i jeszcze więcej miodu. Tu też powraca sugestia dymu drzewnego.;whisky zachodnie;1;Moc:43%
WHISKY BOURBON JIM BEAM PEACH 0,7L 32,5% + SZKLANKA;89.00;https://alkoholeswiata24.pl/gfx/mini/1654172070.2363.jpg, https://alkoholeswiata24.pl/gfx/1654172070.2363.jpg;0;Whisky Burbon Jim Beam Peach 0,7l 32,5% + szklanka Nowa propozycja od największego producenta bourbonów wypuszczona na rynek światowy na początku 2021 roku. To niezwykłe połączenie bourbona z likierem brzoskwiniowym, które doskonale sprawdzi się na letnie wieczory jak i chłodne, zimowe dni. Trunek podany na kostkach lodu lub jako składnik do koktajli orzeźwi każdą spragnioną duszę.  Soczysta brzoskwinia idealnie łączy się z drzewnymi nutami bourbona, akcentami wanilii i karmelu. Całość jest spójna i dobrze zbalansowana.  Bourbon w zestawie ze szklanką będzie dobrym pomysłem na prezent na każdą okazję.;whisky zachodnie;1;Moc:32,5%
WHISKEY WRITERS TEARS COPPER POT 0,7L 40% + PIERSIÓWKA IRLANDIA;214.91;https://alkoholeswiata24.pl/gfx/mini/1671053181.6038.jpg, https://alkoholeswiata24.pl/gfx/1671053181.6038.jpg;0;Whiskey Writers Tears Copper Pot 0,7l 40% + zestaw piersiówka;whisky zachodnie;1;Moc:40%
WHISKY BALLANTINE'S 17 YO 0,7L 40% SZKOCJA;279.00;https://alkoholeswiata24.pl/gfx/mini/1481207409.5268.jpg, https://alkoholeswiata24.pl/gfx/1481207409.5268.jpg;3;Szkocka whisky Ballantine's 17YO 0,7l 40% Ballantine's 17 Year Old  - najczęściej nagradzana 17-letnia szkocka whisky typu blended. Dłuższe dojrzewanie 17-letniego Ballantine's nadaje mieszance dodatkowej głębi smaku i charakteru. Charakteryzuje się subtelnym wrażeniem wędzenia, a jego owocowość i aksamitna konsystencja pochodząca ze świeżych owoców pozwala na niezapomniane doznania.  łęboka, wyważona, elegancka i gładka z nutą słodkiej wanilii, dębu i odczuciem dymu.  pełne, kremowe, soczyste, harmonijne, dębowo-słodkie. Złożona, wibrująca słodycz miodu i kremowe posmaki wanilii z nutą dębu i pikantnej lukrecji.  długi, słodki i gładki z nutą przypraw.;whisky zachodnie;1;Moc:40%
WHISKEY WRITERS TEARS POTSTILL BLEND 0,7L 40% IRLANDIA;199.00;https://alkoholeswiata24.pl/gfx/mini/1570189587.7321.jpg, https://alkoholeswiata24.pl/gfx/1570189587.7321.jpg;0;;whisky zachodnie;1;Moc:40%
WHISKY BOURBON JIM BEAM HONEY 0,7L 32,5%;86.51;https://alkoholeswiata24.pl/gfx/mini/1538391809.252.jpg, https://alkoholeswiata24.pl/gfx/1538391809.252.jpg;6;Jim Beam Bourbon to najlepiej sprzedający się na świecie bourbon. Ma silne rodzinne dziedzictwo, którego formuła nie zmieniła się od ponad 200 lat i była zarządzana przez ponad siedem pokoleń gorzelników z rodziny Beam, zapewniając tę ​​samą stałą jakość od momentu pierwszej produkcji.;whisky zachodnie;1;Moc:32,5%
